by u keren sen kemaren lgsung sampai simcardnya mudah sinyal nya bagus yaaa di tempat saya tconptxlklrl	positive
call of duty knp gk masuk list	neutral
pingin make by u buat paket tapi by u sekarang lebih parah speednya ketimbang	negative
wkwk kalah sama kartu as	negative
halo min kalo kuota kemendikbud untuk bulan juni apa akan ada lagi	neutral
kok error ya	negative
email yg pakai daftar di aplikasi by u kak	neutral
emang tau mark itu siapa min	neutral
cara unreg kartu bagaimana	neutral
sudah cape diresponnya gin mulu paling suruh airplane mode ganti g apn melulu ada solusi lain ga	negative
makasih kado sekaligus thr nya tcoprpkxdie	positive
ini alas pindah dari by u ke provider lain buat sosmed lancar buat game pingnya stuck	negative
benerin aplikasi lu woy	negative
kak paket gb harga rb kembali dong	neutral
justin bieber sama superjunior akhir bisa pakai instagram musik tanpa vpn	positive
yahhh apa apa coba abis di protes baru muncul	negative
hp masih mahal kalo ada yg juta gass lah	neutral
lagi kenapa si min asa jaring susah mulu dari kemaren kemaren	negative
lagi pelihara app	negative
yap tadi siang ga ada sama sekali	negative
byu kenape sih	negative
tahan ya ka	positive
masih trouble tidak coba cek koneksi nya byu kalo maintenance pasti malam soal	negative
bln akhir mang gt ud kyk ilang kuota saya tidak pk dari tgl may tiba kuota saya dari tcovetuzkna	negative
buat apa ada kuota topping kalo yang dipake kuota utama	negative
kok aplikasi tidak bisa buka ya	negative
kirain cuma punya saya nyata semua user eror toh	negative
up adain lagi paket yang bikin aman mbps harga naek jadi k boljug juga	positive
makasih kado ultahnya tcoxltfgpzh	positive
jam hampir achievement masalah internet adalah kendala utama main apex tcodmgtckcp	negative
min banyal banget eror udh dm bilang bru ada salah tapi sudah bulan gin buka netflix	negative
genshin impact tidak sebut	neutral
heeh e mbak udh tak install ulang tetap saja tidak bisa	negative
kalo telkomsel udh g arti by u udh g juga	neutral
by u lg down yaaa	negative
sinyal nya ada tapi gabisa internetan bukan sihh	negative
parah benar dah zoom ga bisa spotify ga bisa pakai vpn baru bisa paket abal abal	negative
ini sistem app byu lagi error apa gimana ya soal suruh istirahat main hp padahal urgent banget beli kuota	negative
haloo by u sinyal kok jelek sekali yaa hari ini paket mahal mahal mau buka twitter atau web aja masak kudu tetering	negative
kenapa beli kuota dri pulsa sekarang harus pakai otp	neutral
coba aja siapa tau signal telkomsel nya udh bagus lagi	positive
aplikasi saya tidak bisa buka info nomor telfon dan email sudah saya kirim di dm tolong di cek	negative
sya udh tahun pke by u tapi ga dapet kuota anniversary	negative
iya nih kalo main game sering lag tidak bisa stabil saya lokasi magetan	negative
aku dipake twitter gabisa	negative
tau kalo sinyal byu di rumah saya sekaranh kenceng banget jd download atau streaming drakor ga bakal megap	positive
pindah ke aja usep	positive
kenapa ini apk nya ga bisa di buka dari kemaren	negative
mimin saya mau tanya dong bisa stop paket unlimited kita ga sih min makasihhhh	neutral
kirain punya ane aja yg gin nyata banyak	negative
kenapa saya isi pulsa daritadi jam	negative
macem macem sih salah satu ya nonton yt dan download game pc	negative
benerin jaring lu deh serius	negative
saya sudah punya kartu by u apakah saya boleh aju kartu by u lagi karena nomor yg lama saya guna untuk usaha bisnis	neutral
sinyal nya jelek banget buset	negative
tambahin dong min jangan mbps	neutral
panjang lagi dong min	neutral
sore paket tlpon saya belum masuk	negative
harga naik cepat naik tapi sama aja pas dipake	negative
tolong dong dari pihak by u saya udh beli paket tinggal jemput kartu d konter yg tunjuk tapi kata stok kartu habis udh hari janji tapi kata kartu tidak ada stok terus ubah lokasi ambil kartu pun gabisa tolong solusi yaa	negative
ek ganti provider nyaah kuota di pakai kalah musingkn anying ah tcourwdqdzky	neutral
miin tolooong gimana ini tiba tiba jaring by u hp saya ilang terus x sudah dimatiin di mode pesawat dll tetep gabisa ga muncul	negative
kog ngga bisa liat masa aktif sisa kuota kak	negative
sekarang jadi agak lelet di daerah jetis bantul	negative
min by u dpt g juga tidak apa cuma telkomsela aj	negative
kartu mba nindy	neutral
jaring tidak kuat	negative
jaring kok hilang	negative
asik sudah bisa terimakasih	positive
halooooo mimin nindy kok begniii terusssss yaaaaaaaaaa tcoolndksxpa	negative
bikin access point name baru aja bro	neutral
by u sinyal g tapi internet mati	negative
di magelang lte masih rasa g	negative
min bisa ga nomor telkomsel jadi by u haha	neutral
apakah harus beli simcard baru lagi kalo by u upgrade ke g	neutral
masih tunggu wild rift	neutral
halo ini kok dari hari ga bisa buka aplikasi sudah bagai cara dilakuin mulai hapus cache trus sudah hapus aplikasi download lagi ini kok masih ya nek kek gin lama lama pakai byu kok gin ya mulai streaming p tiba sinyal e pas buka	negative
jaring busuk	negative
kenapa sinyal dari kemarin h trus di daerah mekarbakti kadungora garut	negative
saat mati lampu dan tidak hujan	neutral
jgn beli yg unlimited karena batas	negative
yang unlimited ga ada thr min jadi rb windu eh	neutral
masa sering kaya gin	negative
paket unlimtd bikin aman jam dah tidak ada ya tcojdqsjtlyl	neutral
ini kenapa min sedih paket sudah mau abis mau panjang gimana sudah minggu ini kayak dini sudah coba uninstall install lagi sama aja hp samsung a tcouipsivafg	negative
jelek amat koneksi jaring tengah kota tcocrxsxkyi	negative
kaya gimana putus nyambung ya harus reconnect mulu sama d	negative
aplikasi lg knp ya kok gabis bisa daritadi mau paket hmmmmm	negative
ga bisa diandelin banget sih kali ini	negative
apps nya kok tidak bisa di buka ya internet lancar	negative
min ini saya beli kuota gb	neutral
lebih murah ya tapi pikir gantung by u nya nu brrti	positive
min ga bisa buka terus	negative
ga tarik ga ada hadiah	negative
admin please cek dm lagi maintenance kah by u huhu	negative
halo kak kalo notifnya begini terus gmn ya saya udh sampai uninstall kali tcogrrodmwm	negative
sudah nonton pakai by u	positive
kalo sudah bayar terus bagaimana tahu kapan kartu sudah sampai di indomaret yg tuju	neutral
by u kerennn keceeeee	positive
punya masalah apa si sama kok akses internetnya ndak bisa padahal buka aplikasi lain bisa tcorgocukjbw	negative
buat instagram lancar	positive
	
kalau belum siap udara di indonesia jgn buka provider baru	negative
oh kenapa emang rewel ga kaya biasanyaa	negative
tumben hari ini lelet ya	negative
ping aman min	neutral
pindah xl wal biar di tanggepin	negative
emang ngertiin kamu yang suka streaming video	positive
punya ku juga gin nin ini gimana ya	negative
sinyal nya bapuk gimana nih lg urgent	negative
aplikasi yg di android lagi gk bisa buka ya	negative
topping by u yang disney hotstar masih langgan psst masukin yang paket bulan juga dong min	neutral
unlimited naik speed harga sesuai dah itu aja	neutral
kalau paket unlimited max cepat	neutral
kenapa buka netflix sama spotify tidak bisa tolong di reply	negative
sinyal tuh benerin dari semalem error mulu	negative
ping waktu maen game minn aduhai sekali	negative
ga terlalu rekomen si buat sekarang mah hehe	negative
kenapa jadi payah banget buat donlot torrent ya cepat mentok kbps begitu kartu ganti telkom tcowdklcati	negative
minggu sekali rutin banget netflixnya tidak bisa akses ini provider saya yg rusak apa gimana deh soal kl tcoxirywrova	negative
kirim via dm ya kak agar bantu cek dan data jaga untuk keluh komplain kait produk dan tcokxclzgwwiz	neutral
tolong bantu kendala saya beli kartu perdana tetapi tidak bisa di aktivasi	negative
by u terimakasih sudah kasih promo kuota gila saya baru saja beli kuota gb dengan harga ribu arti pergb cuma k rupiah makasih	positive
minnn ini knp internet topping buat tiktok gabisa di pakai	negative
harus install ulang lagi tcoeskqztckd	neutral
jaring kok eror terus sih anjnggg	negative
hp nya yg blm siap min	neutral
sorry jbjb download app di apkpure kmrn ngakalin gt krn di playstoee udh ga support tapi barusan bisa lg download di playstore sih	negative
halo min ini byu sudah gabisa dipake ada minggu	negative
sumpah iya banget ih aku dari hari kemarin mau beli kuota ga bisa mulu padahal jam ini sudah habis bingung banget aku dah tanya adminya tapi balesanya itu itu mulu aplikasi juga masih ga bisa di akses	negative
tadi beli pulsa lewat jenius tapi kok blm masuk juga ya apa tidak bisa tapi saldo sudah kurang	negative
aplikasi by u ganggu ya kok dari beberapa hari yg lalu mau cek kuota di aplikasi by u gagal terus loading tidak kelar kelar	negative
bang aja sudah jadi anak yang bisa dari satu aplikasi kalo kamu kapan	positive
ohh byu itu dah banyak yg rekomendasiin	positive
beli kuota by u buat nemenin sahur nanti	negative
min cek sinyal di bandung dong dekat alun alun sinyal cuma dapat h nih	negative
dari daftar transaksi ku mungkin lihat apa topping by u yang sudah pernah dicobain dan jadi favorit ku tcoaisewyoas	positive
download aplikasi dulu ya min	neutral
moga guna lama tidak di bedain sama yg baru hmm	neutral
sangat tidak saran untuk main game ya adek adek	negative
by u mang gaada obat	positive
kita satu sinyal nyata saya juga kek gtu make yg unlimited	negative
capek aku yu sm km tcoxrtwabpdx	negative
jam tapi dkrng udh g ada	neutral
sama nih aku juga masa internet byu suka bengong	negative
belakang sinyal kacau	negative
ah terimakasih tcozpkrergym	positive
jaring lot yg sedia telkomsel bagai induk	negative
bogor sudah masuk sinyal g gakk min	neutral
g hanya untuk jakarta dan sekitar	neutral
bulan pakai byu kaya aman aman aja cuman sekarang sekarang sering rto apalagi kalo di jam jam sibuk	negative
kasih ya min si mark	neutral
makanya itu buat chat susah semua susah hadehh rasa rugi beli paket mahal mahal nyata tidak guna	negative
min ini kenapa aplikasi gin terus gabisa dibukaa tolong sudah dari bulan lalu kaya gin te tcohwuuivdal	negative
gmn cr nya sudah ke youtube dpt gb gratis	neutral
paket nya gede kuota nya dan harga nya ga mahal kok	positive
min mau nanya dong by u sudah bisa e sim belum ya	neutral
min ini jaring byu burik banger dari pagi edge terus tidak bisa kerja	negative
permisi min mau tanya tentang aktivasi tcohwhlft x samsung	neutral
kok gada terang apa apa ya dari byu kek mgabarin gituu	negative
yg mbps bikin permanen dong	neutral
aku baru tau kamu punya musik yang senang ost transformers kalau bisa di masukin juga yaaa saranghae tcowtgllciii	positive
sayang ribu sayang tempat saya sinyal byu lot	negative
kenapa susah sekali buka aplikasi byu	negative
kok aplikasi nya ga bisaa buka sii	negative
emoji buat jaring yg tengah hari td hilang	negative
lagi gabisa beli paket ya	negative
min cara beli kuota gmn selain dri aplikasi soal lagi mt aplikasi by u	neutral
min kok nomor byu bisa tidak dapet sinyal g ya padahal di tempat yg sama nomor byu lain bisa dapet mohon bantu min	negative
min paket gb ampe kapan	neutral
rencana mau ganti kartu ke indosat	negative
kita butuh thr tanpa beli kuota	negative
by u kenpa sih tiap buka app lot banget kadang tidak bisa mau cek paket susah banget	negative
umum aplikasi by u error sejak update versi ke tidak bs buka	negative
pending bangeet	negative
aplikasi gabisa buka mulu kenapa nih	negative
kok kartu by u ku gabisa buat akses twitter dan pinterest tapi buat aplikasi lain masih bisa mohon bantu min	negative
mudah mudah baik jaring	negative
giga k	neutral
sudah saya kirim	negative
hampir gb sie kalau pakai normal hari gb	neutral
data aniversary ga ada lg ya	neutral
alhamdulillah masih	positive
baru sadar nyata spotify dan tokped emang dari kmrn juga gabisa website tokped kayak di blokir gitu sama kayak net tcoyrqrzxbbvm	negative
sudah ga asik unlimited pakai fup hijrah ke lagi ah	positive
nungguin rejeki nomplok dari by u	neutral
aplikasi kok sekarang sering gbs di akses sih servere tambah atau diupgrade lagi dong	negative
kuota byu yg k kok uda gaada sihhhhh sedih nihhh	neutral
jaring dibenerin dulu	negative
please ini kenapa ya min tiap buka aplikasi selalu begini sudah uninstall aplikasi tetep begini terus saya mau cek kuota dan beli paket data ga bisa tcolekzpcfjpm	negative
sedih banget td sore jaring byu ga stabil buat zoom	negative
tipsnya jangan pakai byu	negative
ni sinyal makin kesini kok makin sulit ya	negative
eh iya benar banget lagi thank you by u	positive
ada promo murah kah dih tgl ini	neutral
akhir dapat thr dari papa	positive
kok aku kemaren ultah gadapet kuota gratis min	negative
makanya pakai	positive
app kok ga bs dibukaaaa mau beli paket min	negative
sinyal kok ilang ilangan ya	negative
harap dapat kuota dari mimin karna tanggal besok ulang tahun	neutral
seperti emang kunci sudah pindah ganti modem pindahin ke hape semua sama aja langsung ngacir kalau di hape ato modem pakai nomer lain emang kampret ini byu komplen sama cs diputerin ga jelas solusi	negative
halo kenapa sinyal saya tiba tiba hilang dan tidak baca ya	negative
min ini kenapa ya telah up ga bisa buka appsnya tcoashzsgv	negative
haloo apa by u sedang eror kok saya kirim sma buat verifikasi mobile banking tidak kirim dari kemarin	negative
asiknyaa dapat kado	positive
benerin dulu deh aplikasi makin hari makin busuk	negative
woy bangsat balikin uang saya ngk bisa aktif kartu suruh tunggu sdh lebih jam	negative
sudah hari kenapa sinyal h terus min padahal aku pakai yg gb bln apa kualitas sinyal makin nurun	negative
makin hari makin gajelas sinyal nya	negative
app by u kenapa si tiap w buka error mulu	negative
sayang cuma ke sama by u padahal mantan pakek telkomsel	neutral
mbps yak jan harap dl lu kelar dit	neutral
hmmm sudah biasa rb gb	neutral
hape lah tinggal search google atau buka youtube	negative
maqn kesini maqn lot aja nih apalg kalo ujan	negative
halo by u kenapa signalnya mati terus ya	negative
ngk usah bnyk tingkah kalau jrngn msh nebeng	negative
min aku mau beli kartu by u tapi beliin ya	neutral
emang paling bisa pdkt nya ke kita kita	positive
isi pulsa ko blm masuk min dari malam	negative
di speed test doang bagus nya kalau akses website lain atau update aplikasi lot nya minta ampunm ada yg kek gitu tidak	negative
kenapa ga ada genshin impaaaaccccttttttttt	neutral
ha g tidak bro aku hanya ingin main ml tanpa ping naik turun	negative
moveon ke dong sist	positive
halo sy guna by u kenapa akses app by u susah sekali saya mau isi paket soal	negative
ini jaring di dramaga kenapa oy dari sore eror gin ilang ilangan kaya hayabusa	negative
kenapa lagi ini kok ga konek internet benar benar	negative
cara guna topping mola by u di aplikasi mola gimana	neutral
min parah aku baru tau ultah kemarin aku ga dapet kuota gratis deh	neutral
apk by u ku gabisa di akses malah	negative
admin kok gk bisa buka apk webtoon ya padahal pakai wifi lancar aja	negative
are u okay kok daerah lot banget padahal belum lancar	negative
kak aplikasi sering masalah nie	negative
internetnya dari kemaren lot banget kenapa deh	negative
untuk yang sekian kali saya masih kecewa dengan cepat internet yang saya dapat	negative
ini sudah diupdate tapi kenapa tidak bisa buka tcolxuqsdrlb	negative
kenapa nih ngga bisa buka app buat ngecek kuota tcogvlglulsp	negative
harga yg paket per mbps turunin itu ajah	neutral
kabar besokanya buru cek out huft	neutral
ebuset benerin ini dulu napa mint	negative
kouta saya yang belum masuk gimana nih udh hari lebih bom ada jelas dari by u jangan suruh tunggu terus dong sudah muak saya	negative
kenapa si kalau mo isi kuota krn habis dari smlm buka aplikasi pakai wifi gk bisa apa emang lg ganggu tcodanzunepx	negative
buat zoom kenapa tak bisa yes	negative
dari hari yang tiap hujan petir selalu turun mulu sinyal dan ga bisa internetan sama sekali selalu pakai tetring tetangga terus kenaoa ya yangguan mulu	negative
lagi asik download eh sinyal by u mendaduck lot horror banget ga sih	negative
gadapet rhr jadi ga beli apa apa	negative
halo kok di android byu gabisa login via nomor ya	negative
jaring iku lhoooo	negative
bikin emosi kan	negative
nindyyyyyy ini sinyal byu kok jelek ya padahal sudah set g mana bar penuh semua tapi main game malah tcotibhcyal	neutral
min mau nanya dong kalau kita beli paket unlimited mb yang rb kali apakah cepat akan lipat jadi mbps serius nanya	neutral
ada nih min jadi waktu main pubg ni min baru banget mau ngerush eh tiba tiba ping drop	negative
masih begitu tidak bang saya sampai sekarang masih tidak bisa buka	negative
cok koe saiki lot banget su	negative
ko aku pas ulang tahun ga dapet ini sih min	neutral
appan g ga terlalu harap buat w yg cuma idup di desa g aja bom sampai sini kog	negative
kalo saya make yg unlimited kadang kalo ga ada duit beli yg gb siii tapi kalo yg gb paling habis dlm minggu	neutral
hallo min ini sinyal g kenapa nih waduh saya lagi streaming tiba tiba no connections bagaimana padahal saya langgan paket unlimited ini	negative
tapi repot banget anjir tadi make hp temen dulu buat isi kuota	negative
kuota internet dong	neutral
udahhh bejo ne ni dah bs mas step kudu connect reconnect wifi trs	negative
ya baru tau sekarang unlimited bisa tetheringan uaa	positive
baik ini dulu lah era digital masak restart hp mau cek kuota tcoggvdfyxd	negative
hp masih mahal	neutral
netflix di blok aku buka pakai telkomsel bisa tuh	negative
lagi ganggu aku buat streaming kok gabisa	negative
thanks byu berkat paket unlimited byu saya untuk bulan gk takut lagi buat nonton youtube	positive
udahhh ini eror gr gr update app gamau masuk igil kesel banget asli	negative
kenapasih gabisa loading sama sekali lagi baik apa gimana	negative
kenape nih gabisa buka netflix sahabat	negative
maklum sesuai moto byu semua mau	negative
punya ku juga loh min tcovhhaenflk	negative
min kenapa ga bisa masuk aplikasi siih dari semalem	negative
dari tadi mau aktifin sim card tidak bisa gimana ini tcoqvsbdlitr	negative
kenapa sinyal mu timbul tenggelam deh dari tadi siang	negative
ya masa vpn terus	negative
baik banget dah hueeee tau aja lagi butuh jugaa makasii banyak banyak yaaaa tcodpyaohvz	positive
buka tiktok lancar tapi buka netflix	negative
min saya beli pulsa lewat aplikasi tadi siang sudah di transfer tapi belum masuk	negative
hari ini habis beli yang mbps hari skrg tiba gabisa nyambung internet duhhh	negative
di pas anniversary kasih kuota	negative
hahahha adminnya gabut yaaaaa	neutral
baik si responnya cepet	positive
smaa bgttt saya main game kalah mulu grgr tbtb jaring lot	negative
misi min cara ngecek nomor masih aktif atau tidak gimana ya	neutral
lagi download terus kuota abis tidak nyadar jadi nyedot pulsa untung by u tidak gitu ya jadi tidak perlu was was	negative
tri aja sudah	negative
nyata ada temennya gbsa juga	negative
yaps provider ini nama semua harga paket murce banget tcolpqfiljmj	positive
sinyal dong baik tiap buka aplikasi buat ngecek kuota dll ga bisa mulu padahal selalu pakai yg paling mahal k bulan buka aplikasi something went wrong mulu tiba sinyal ga ada tiap komplen suruh nyatet tgl waktu trouble dll	negative
pakai kartu belah	negative
mint kok kuota disney hotstar ku ga bisa kepake ya di aplikasi disney loading mulu tapi cek kuota di byu masih gb	negative
saya sedang proses pindah apakah bisa guna alamat yang lama	neutral
awas aja yee kalo lama terus sampai hari gabisa buat internetan	negative
knp y bayu pas awal bagus tapi lama lama jleg	negative
punya kamu masih eror kah wa nya skrg	negative
naikin speed unlimited gk banyak banyak yg kayak kemarin aja mbps	neutral
apalagi kalo ujan buset asa tinggal di hutan	negative
kok paket rb	neutral
aku beli sim rb udh dapet kuota gb makasih	positive
min kok unlimited	neutral
podcast yg bahas aplikasi busuk dan cs yg bisa cuman sok asik tapi tidak kasih solusi ada tidak ya	negative
friendster itu lupa lagi bentuk nya seperti apa dulu	neutral
sinyal jelek banget demi allah kesel aing	negative
makasih perhati banget cieee tcoqdvxstep	positive
tidak mau nyediain topping mola tv nih	neutral
apa lagi maintenance ya	negative
bagus lah ada variasi unlimited mbps tambah lagi variasi unlimitednya	positive
jangan suruh saya restart hp	negative
unlimited tapi kualitas speed byu akhir ini turun nih	negative
kenapa sinyal timbul tenggelammmmm	negative
kuota disney kok gabisa dipake ya padahal kuota utama sudah abis	neutral
percuma byu g bagus buat game online lag	negative
yg ribu	neutral
min kok di camat maleber kuningan jelek sinyal nya	negative
jaring byu lebih jelek dari si tiga	negative
gila sekali anda saya aja gb bisa minggu itu juga cuma rb pakai im	negative
min tadi sinyal by u ilang mana	negative
min knapa tiba tiba kartu by u saya hilang signal eror sudah jambegini terus padahal kartu kawan saya aman saja di area yg sama	negative
apa pat gua masih kek kontol ga disempakin ga jelas benar telkomsel ini kontol pepek jembut	negative
ini gimana sih makin lama makin ruwet	negative
tanya min apakah kartu by u bisa volte kaya simpati ashalo	neutral
baik ketika tanggal tua serang tcoolmvpeabl	positive
min kenapa dari kemaren seperti ini kalau bukak aplikasi tcoqifuxphlw	negative
makasih dapet kuota gratis tcopjszfqgu	positive
kenapa dari kemarin apps saya kek gin mulu ya tcornhokyi	negative
jaring g kalau maksimal juga mantap lagi g tapi kalau enggak rela buat korbanin kuota demi rasa speed g kes sayang	neutral
apakah byu lagi ganggu	negative
makasih kado tcomolzcisw	positive
lihat min ya walaupun sekarang udh tidak bisa main ml krn klau login selalu tidak kuat jaring nya	negative
ini kenapa eror terus sih pas mau masuk aplikasi	negative
harga paket murah banget	positive
akhir ini koq koneksu g bisa buat akses beberapa web ky pinterest spotfy dll y apa memang lg masalah y	negative
baik banget	positive
kenapa tiap buat aplikasi sering gin min sering banget lhoo ini	negative
nasib pas lagi tegang tawur tiba hubung kembali pas hubung tau dah tewas	negative
unlimited naik speed	neutral
tpi lot	negative
paket by u gb hari tidak bisa buat buka instagram	negative
tau ga sinyal lu buat game ampas banget	negative
kenapa aplikasi susah buka	negative
tau ndiri lah csnya bot	negative
paket thr spesial kurma gb murmer nya knp malah dihilangin sih	neutral
biasa bulan bisa gb lebih buat streaming anime sama download file	neutral
harus aku beli ipon supaya bisa g	neutral
lau juga problem	negative
dear admin hari ini sinyal nya ganggu kaum ldr untuk lepas kangen buaaanget	negative
aku kemarin tgl ultah tapi tidak dapet apa	negative
plis banget lagi kelas sampai harus ngungsi ke musholla biar dapet wifi tcojdxdjzem	negative
itu teknisi ngapain kok mlah ngecek dri luar kocak dh tpi sayang banget itu lngsng co angus dong sisa	negative
netflix disney mining trading steam online games udh ituuu aja circle hari gb saya	neutral
bang kok dari pagi ngada sinyal bang	negative
kalo ngga pakai vpn wifi ngga bisa buka	negative
kenapa hari ini jaring ganggu mulu di bandung min kadang malah tidak ada sinyal sama sekali	negative
ada yang pakai paket game by u buat game sama aja apa lebih bagus sih	neutral
ih ada bonus kece amat	positive
lumayan gocap dpt gb tcopabwmyuy	positive
cuma yang perhati	positive
lemott banget cuk	negative
gb ribu mewnghilang dari app mana	neutral
halooo min kok apknya tiap buka keluar terus yaaa	negative
yes kali yg mbps pas msh kenceng	positive
aplikasi by u gimana ini belum bisa masih crash mulu	negative
sinyal knpa jelek terus tolong aku lg sedih malah jd tambah sedih	negative
ko ane gadapet kuota ulang tahun ya min tcoojsvtzkcp	neutral
maaf jbjb mba wa saya juga gabisa mba	negative
cek dm min sinyal ngilang	negative
plis jaring benerin min download gb cepat cuman gin kuota masih gb tapi semua kek gk guna tcoaksplf	negative
agak maksa ya byun	negative
harus ganti kartu juga tidak min	neutral
deri kemarin tanya sudah di jawab trs di suruh kirim video pas masuk aplikasi kak tapi masih belum ada ubah trs aku tanya lagi tapi jawab juga itu mulu kesel ih padahal dulu ngga gin lo huhuhu	negative
apa karena ini min internet jadi lelet	negative
tidak ah jaring labil	negative
emang sinyal gin terus kah sudah hampir bulan gada ubah	negative
aku waktu itu ultah tidak dpt ya hadiah dari by u	negative
ini ganti unlimited	neutral
ngabuburit sama sinyal yang eror	negative
sering banget beberapa aplikasi susah buka dan harus restart hp dulu kenapa ya min mohon baik	negative
kenapa byu gabisa buka netflix	negative
kenapa jaring ga bisa untuk dengerin lagu di spotify	negative
kok jam gin belum sampai indomaret padahal sudah tgl kenapa min tcolzfqv	negative
jaring g nya kok lemah yah	negative
masih setia sama byu aman jaya sudah mbps	positive
min barusan uda x coba tapi gagal terus pas buat akun gimana ya	negative
ko aku ga di kasih	neutral
bisa tidak yang gb nya masa aktif bulan tcolxjlfpdz	neutral
topping ignya ko gbs dipake ninnn	negative
dear admin jaring di kelapa dua depok jelek masa	negative
ribet banget registrasi	negative
yang k gb buat hari	neutral
sudah hari ke loh ini masih g ada progress	negative
tapi tetep aja ya lelet sama konek ke server host apa makin lelet tapi noren parah s tcozgqyrjokg	negative
min kok yang gb ribu ilang	negative
iya ini dari pagi mau beli paket malah ga bisa buka mana gabisa pakai	negative
dengan jawab yg tetap standard tcoqxxpiqyga	negative
app knp sering ga bs di buka	negative
apakah paket g akan tetep mahal dan buat apa g kalau pket cuma max mbps	neutral
niat jadi provider ga sehh	negative
by u ilang sinyal ga ada kuota lagi selain ini tolongggg tcorksysrvfd	negative
jangan pakai jaring by u tips nya	negative
ini kenapa nonton youtube bukan kuota topping youtube yang habis min tcolxvcjvhrh	negative
gabisa nonton	negative
akuuuuu sedi banget tapi sekarang ga ada paket data yang jam ribu huhu padahal itu ngebantu banget	negative
padahal mau ranked	negative
pakai dong soal paket murah	positive
min mau tanya apa benar masa aktif kartu by u semur hidup asal dpat sinyal internet	neutral
saya ya ngikutin cara apn dari byu doang dah lancar bet kalo yg pure telkom tcovxrriyy	positive
aigoo apa tuh min jangan bikin jantung tali yak	neutral
